[
  {
    "id": "MCQ-2201202-0017",
    "certification": "CompTIA A+ Core 2",
    "exam": "220-1202",
    "domain": "Operating Systems",
    "topic": "File Systems",
    "difficulty": "hard",
    "question_type": "single_best_answer",
    "question": "A removable drive must be readable and writable by Windows and macOS and support files larger than 4 GB. Which file system is the best general choice?",
    "options": [
      {
        "key": "A",
        "text": "FAT32"
      },
      {
        "key": "B",
        "text": "exFAT"
      },
      {
        "key": "C",
        "text": "NTFS with default permissions"
      },
      {
        "key": "D",
        "text": "ext4"
      }
    ],
    "correct_keys": [
      "B"
    ],
    "explanation": "exFAT supports large files and broad Windows/macOS compatibility without FAT32’s 4 GB file limit.",
    "tags": [
      "filesystems"
    ],
    "privacy_note": "Synthetic training scenario only. Do not use real student, staff, parent, credential, or network details."
  },
  {
    "id": "MCQ-2201202-0018",
    "certification": "CompTIA A+ Core 2",
    "exam": "220-1202",
    "domain": "Operating Systems",
    "topic": "Installing Operating Systems",
    "difficulty": "hard",
    "question_type": "single_best_answer",
    "question": "A technician needs a clean Windows install on multiple identical devices with minimal manual configuration. Which approach best matches modern deployment practice?",
    "options": [
      {
        "key": "A",
        "text": "Manual DVD install on each device with local accounts."
      },
      {
        "key": "B",
        "text": "Zero-touch or automated deployment with approved image/provisioning process."
      },
      {
        "key": "C",
        "text": "Copy C:\\Windows from one device to another."
      },
      {
        "key": "D",
        "text": "Install from an unverified ISO found online."
      }
    ],
    "correct_keys": [
      "B"
    ],
    "explanation": "Automated/zero-touch deployment reduces inconsistency and supports approved configuration at scale.",
    "tags": [
      "deployment"
    ],
    "privacy_note": "Synthetic training scenario only. Do not use real student, staff, parent, credential, or network details."
  },
  {
    "id": "MCQ-2201202-0019",
    "certification": "CompTIA A+ Core 2",
    "exam": "220-1202",
    "domain": "Operating Systems",
    "topic": "Task Manager",
    "difficulty": "hard",
    "question_type": "single_best_answer",
    "question": "A user reports slowness only during morning sign-in. Which Task Manager area gives the most direct first clue about apps loading at sign-in?",
    "options": [
      {
        "key": "A",
        "text": "Startup apps"
      },
      {
        "key": "B",
        "text": "Fonts"
      },
      {
        "key": "C",
        "text": "Disk Management"
      },
      {
        "key": "D",
        "text": "Windows Defender Firewall rules"
      }
    ],
    "correct_keys": [
      "A"
    ],
    "explanation": "Startup apps help identify programs launching at sign-in and impacting user experience.",
    "tags": [
      "Task Manager",
      "performance"
    ],
    "privacy_note": "Synthetic training scenario only. Do not use real student, staff, parent, credential, or network details."
  },
  {
    "id": "MCQ-2201202-0020",
    "certification": "CompTIA A+ Core 2",
    "exam": "220-1202",
    "domain": "Operating Systems",
    "topic": "Windows Network Command Line",
    "difficulty": "hard",
    "question_type": "single_best_answer",
    "question": "A Windows client can reach 8.8.8.8 but cannot reach intranet.example.local by name. Which command best confirms name resolution behaviour?",
    "options": [
      {
        "key": "A",
        "text": "format"
      },
      {
        "key": "B",
        "text": "nslookup intranet.example.local"
      },
      {
        "key": "C",
        "text": "sfc /scannow"
      },
      {
        "key": "D",
        "text": "net user /domain"
      }
    ],
    "correct_keys": [
      "B"
    ],
    "explanation": "nslookup directly tests DNS resolution for a hostname.",
    "tags": [
      "CLI",
      "DNS"
    ],
    "privacy_note": "Synthetic training scenario only. Do not use real student, staff, parent, credential, or network details."
  },
  {
    "id": "MCQ-2201202-0021",
    "certification": "CompTIA A+ Core 2",
    "exam": "220-1202",
    "domain": "Operating Systems",
    "topic": "Windows Firewall",
    "difficulty": "hard",
    "question_type": "single_best_answer",
    "question": "An app works locally but cannot accept inbound connections from the same subnet. Network connectivity is otherwise fine. What is the best first Windows host-level check?",
    "options": [
      {
        "key": "A",
        "text": "Inbound firewall rule/profile status for the app or port."
      },
      {
        "key": "B",
        "text": "Monitor brightness settings."
      },
      {
        "key": "C",
        "text": "Recycle Bin size."
      },
      {
        "key": "D",
        "text": "Keyboard language."
      }
    ],
    "correct_keys": [
      "A"
    ],
    "explanation": "Host firewall inbound rules and network profile can block otherwise valid connections.",
    "tags": [
      "firewall"
    ],
    "privacy_note": "Synthetic training scenario only. Do not use real student, staff, parent, credential, or network details."
  },
  {
    "id": "MCQ-2201202-0022",
    "certification": "CompTIA A+ Core 2",
    "exam": "220-1202",
    "domain": "Operating Systems",
    "topic": "Active Directory",
    "difficulty": "hard",
    "question_type": "single_best_answer",
    "question": "A user can sign into Windows but cannot access a department share that colleagues can access. What evidence is most useful before escalation?",
    "options": [
      {
        "key": "A",
        "text": "User’s password and MFA code."
      },
      {
        "key": "B",
        "text": "Exact share path, error message, group membership expectation, device name, and whether other users/devices are affected."
      },
      {
        "key": "C",
        "text": "A statement that Active Directory is broken."
      },
      {
        "key": "D",
        "text": "A screenshot of every mapped drive for all staff."
      }
    ],
    "correct_keys": [
      "B"
    ],
    "explanation": "Access issues require scope, path, error, group/permission context, and affected device/user comparison without collecting secrets.",
    "tags": [
      "AD",
      "permissions"
    ],
    "privacy_note": "Synthetic training scenario only. Do not use real student, staff, parent, credential, or network details."
  },
  {
    "id": "MCQ-2201202-0023",
    "certification": "CompTIA A+ Core 2",
    "exam": "220-1202",
    "domain": "Operating Systems",
    "topic": "macOS",
    "difficulty": "hard",
    "question_type": "single_best_answer",
    "question": "A macOS user cannot find a file but believes it was recently opened. Which native feature is best for searching the device quickly?",
    "options": [
      {
        "key": "A",
        "text": "Spotlight"
      },
      {
        "key": "B",
        "text": "Event Viewer"
      },
      {
        "key": "C",
        "text": "Registry Editor"
      },
      {
        "key": "D",
        "text": "Group Policy Management"
      }
    ],
    "correct_keys": [
      "A"
    ],
    "explanation": "Spotlight is macOS’s built-in search feature.",
    "tags": [
      "macOS"
    ],
    "privacy_note": "Synthetic training scenario only. Do not use real student, staff, parent, credential, or network details."
  },
  {
    "id": "MCQ-2201202-0024",
    "certification": "CompTIA A+ Core 2",
    "exam": "220-1202",
    "domain": "Operating Systems",
    "topic": "Linux Commands",
    "difficulty": "hard",
    "question_type": "single_best_answer",
    "question": "A Linux service is consuming heavy CPU. Which command is the best first live view of processes?",
    "options": [
      {
        "key": "A",
        "text": "top"
      },
      {
        "key": "B",
        "text": "chmod"
      },
      {
        "key": "C",
        "text": "pwd"
      },
      {
        "key": "D",
        "text": "mv"
      }
    ],
    "correct_keys": [
      "A"
    ],
    "explanation": "top provides a live process/resource view.",
    "tags": [
      "Linux",
      "processes"
    ],
    "privacy_note": "Synthetic training scenario only. Do not use real student, staff, parent, credential, or network details."
  },
  {
    "id": "MCQ-2201202-0025",
    "certification": "CompTIA A+ Core 2",
    "exam": "220-1202",
    "domain": "Security",
    "topic": "Authentication and Access",
    "difficulty": "hard",
    "question_type": "single_best_answer",
    "question": "A user enters correct credentials but SSO fails only for one cloud app after a role change. Which cause is most likely?",
    "options": [
      {
        "key": "A",
        "text": "The monitor cable is loose."
      },
      {
        "key": "B",
        "text": "App assignment, group claim, or SAML/OIDC attribute mapping no longer matches access rules."
      },
      {
        "key": "C",
        "text": "The user’s keyboard is Bluetooth."
      },
      {
        "key": "D",
        "text": "DHCP is unavailable."
      }
    ],
    "correct_keys": [
      "B"
    ],
    "explanation": "SSO to one app often depends on assignment and claims/attributes after role or group changes.",
    "tags": [
      "SSO",
      "SAML",
      "access"
    ],
    "privacy_note": "Synthetic training scenario only. Do not use real student, staff, parent, credential, or network details."
  },
  {
    "id": "MCQ-2201202-0026",
    "certification": "CompTIA A+ Core 2",
    "exam": "220-1202",
    "domain": "Security",
    "topic": "Malware",
    "difficulty": "hard",
    "question_type": "single_best_answer",